input_name,wiki_name,wiki_description,wiki_url,category,lat,lon
Cour d'Honneur des Invalides,Cour d'honneur de l'hôtel des Invalides,"The main courtyard of the Hôtel des Invalides, located in the northern part of the Hôtel des Invalides, in the 7th arrondissement of Paris, is a symbolic courtyard of this monument.",https://fr.wikipedia.org/wiki/Cour_d%27honneur_de_l%27h%C3%B4tel_des_Invalides,Monument / Landmark,48.85646,2.312694
Carrefour de l'Odéon,Carrefour de l'Odéon,"The Carrefour de l'Odéon is a square located in the Odéon district in the 6th arrondissement of Paris. It is frequently confused with Place Henri-Mondor, adjoining and delimited by Boulevard Saint-Germain, which is distinct from the latter in the land register.",https://fr.wikipedia.org/wiki/Carrefour_de_l%27Od%C3%A9on,Historic Site,48.851815,2.338688
Pont de Sully,Pont de Sully,"The Pont de Sully (or Pont Sully; French pronunciation: ) is a bridge across the Seine in Paris, France.",https://en.wikipedia.org/wiki/Pont_de_Sully,Bridge,,
Place de l'Hôtel de Ville — Esplanade de la Libération,Place de l'Hôtel-de-Ville – Esplanade de la Libération,"The Place de l'Hôtel-de-Ville – Esplanade de la Libération is a public square in the 4th arrondissement of Paris, located in front of the Hôtel de Ville. Before 1802, it was called the Place de Grève. The French word grève refers to a flat area covered with gravel or sand situated on the shores or banks of a body of water.",https://en.wikipedia.org/wiki/Place_de_l%27H%C3%B4tel-de-Ville_%E2%80%93_Esplanade_de_la_Lib%C3%A9ration,Historic Site,,
Basilique Notre-Dame-des-Victoires,"Notre-Dame-des-Victoires, Paris","The Notre-Dame-des-Victoires (French pronunciation: ) is a minor basilica located on rue Notre-Dame-des-Victoires in the 2nd arrondissement of Paris. It was begun as an Abbey church, and constructed between 1629 and 1740 in the French classical style. Its name was given by King Louis XIII, who dedicated it to his victory over the Protestants at La Rochelle in 1628 during the French Wars of Religion. Notre-Dame-des-Victoires is famous for the ex voto offerings left there by the faithful. Over 37,000 devotional plaques, silver and gold hearts, as well as military decorations, have been left at the basilica. The closest Métro station is 'Bourse'.","https://en.wikipedia.org/wiki/Notre-Dame-des-Victoires,_Paris",Church,,
La Faluère,René Lefebvre de La Faluère,"René Lefebvre de la Faluère, lord of la Faluère, is a French magistrate, born in Tours on August 6, 1632, died in Paris on March 21, 1708, first president of the Parliament of Brittany from May 5, 1687 until March 2, 1703 when he was replaced by Pierre de Brilhac. He was advisor to the king in his councils, president of the fourth chamber of inquiries of the Parliament of Paris, 1678, then first president of the Parliament of Brittany.",https://fr.wikipedia.org/wiki/Ren%C3%A9_Lefebvre_de_La_Falu%C3%A8re,Historic Site,,
Pont Charles de Gaulle,Pont Charles-de-Gaulle,"The Pont Charles-de-Gaulle (French pronunciation: , Charles-de-Gaulle Bridge) is a steel-reinforced concrete girder bridge straddling the river Seine in the eastern part of Paris. It is a one-way bridge carrying road traffic from the 13th arrondissement to the 12th arrondissement. Another one-way bridge further downstream, Pont d'Austerlitz, carries traffic in the opposite direction.",https://en.wikipedia.org/wiki/Pont_Charles-de-Gaulle,Bridge,,
Jardins Pereire,Frères Pereire,The Pereire brothers — Émile (1800-1875) and Isaac (1806-1880) — were French entrepreneurs and businessmen of the 19th century.,https://fr.wikipedia.org/wiki/Fr%C3%A8res_Pereire,Historic Site,,
Place Sainte Marthe,Place Sainte-Marthe,Place Sainte-Marthe is a street located in the Hôpital-Saint-Louis district of the 10th arrondissement of Paris.,https://fr.wikipedia.org/wiki/Place_Sainte-Marthe,Historic Site,48.8741062,2.3725567
Square Carpeaux,Square Carpeaux,"Square Carpeaux is a square located in the 18th arrondissement of Paris, in the Grandes-Carrières area.",https://fr.wikipedia.org/wiki/Square_Carpeaux,Historic Site,48.891696,2.331612
Pont de la Concorde,Pont de la Concorde,,https://en.wikipedia.org/wiki/Pont_de_la_Concorde,Historic Site,,
Place Sainte-Opportune,Place Sainte-Opportune,"Place Sainte-Opportune is a street in the 1st arrondissement of Paris, France.",https://fr.wikipedia.org/wiki/Place_Sainte-Opportune,Historic Site,48.859621,2.347172
Parvis de Notre-Dame,Parvis Notre-Dame - place Jean-Paul-II,"The Notre-Dame square - Place Jean-Paul-II is a square in Paris located opposite Notre-Dame Cathedral, on its square, which took the name of the Pope and Saint John Paul II in 2006.",https://fr.wikipedia.org/wiki/Parvis_Notre-Dame_-_place_Jean-Paul-II,Historic Site,48.85361,2.34806
Place du Maréchal Juin,Place du Maréchal-Juin,Place du Maréchal-Juin is a square in the 17th arrondissement of Paris.,https://fr.wikipedia.org/wiki/Place_du_Mar%C3%A9chal-Juin,Historic Site,48.884931,2.297292
Porte de Saint-Ouen,Porte de Saint-Ouen,The Saint-Ouen gate is one of the seventeen gates opened in the walls of Thiers in the middle of the 19th century to protect Paris. It was built around 1840 in the former commune of Montmartre.,https://fr.wikipedia.org/wiki/Porte_de_Saint-Ouen,Historic Site,48.8975,2.32889
Place Martin Nadaud,Place Martin-Nadaud,Place Martin-Nadaud is a square located in the 20th arrondissement of Paris.,https://fr.wikipedia.org/wiki/Place_Martin-Nadaud,Historic Site,48.864895,2.394735
Les Jardins de Roland Garros,Stade Roland-Garros,"The Roland-Garros stadium is a tennis stadium built in 1927 and located in the west of Paris at Porte d'Auteuil, on the edge of the Bois de Boulogne. Every year it hosts the French Open tennis tournament (created in 1891), as well as the Paris Major Premier Padel (since 2022).",https://fr.wikipedia.org/wiki/Stade_Roland-Garros,Historic Site,48.847164,2.249217
Fondation Louis Vuitton (chantier),Fondation d'entreprise Louis-Vuitton,"The Louis-Vuitton corporate foundation, formerly the Louis-Vuitton corporate foundation for creation launched in October 2005, is a corporate foundation created by the LVMH group and its houses. Its objective is to perpetuate the sponsorship actions undertaken since 1990 by the group.",https://fr.wikipedia.org/wiki/Fondation_d%27entreprise_Louis-Vuitton,Historic Site,48.87666667,2.26333333
Mur de la Paix,Mur pour la Paix,"The Wall for Peace is a monument erected in March 2000 in front of the Military School, on the Champ-de-Mars, in the 7th arrondissement of Paris, and dismantled in June 2020 after years of protest from local residents. Since then, the new location of this monument on Avenue de Breteuil has been the subject of controversy.",https://fr.wikipedia.org/wiki/Mur_pour_la_Paix,Monument / Landmark,48.8534,2.30199
Église Notre-Dame-des-Champs,Église Notre-Dame-des-Champs de Paris,"The Notre-Dame-des-Champs church is located at 91, boulevard du Montparnasse, in the 6th arrondissement of Paris.",https://fr.wikipedia.org/wiki/%C3%89glise_Notre-Dame-des-Champs_de_Paris,Church,48.843156,2.326858
Porte de Vanves,Porte de Vanves,"Porte de Vanves is a gate in Paris, France, located in the 14th arrondissement.",https://fr.wikipedia.org/wiki/Porte_de_Vanves,Historic Site,48.8276226,2.3052565
Place du 18 Juin 1940,Boulevard du Montparnasse,"The Boulevard du Montparnasse (French pronunciation: ) is a two-way boulevard in Montparnasse, in the 6th, 14th and 15th arrondissements of Paris.",https://en.wikipedia.org/wiki/Boulevard_du_Montparnasse,Historic Site,,
Temple protestant de l'Oratoire du Louvre,Oratoire du Louvre,"The Église réformée de l'Oratoire du Louvre is a historic Protestant church located at 145 rue Saint-Honoré – 160 rue de Rivoli in the 1st arrondissement of Paris, across the street from the Louvre. It was founded as a Catholic church in 1611, became the royal chapel of France under Louis XIII, and then became a Protestant Church under Napoleon I in 1811. It is now a member of the United Protestant Church of France.",https://en.wikipedia.org/wiki/Oratoire_du_Louvre,Church,,
La Chapelle Sainte Rita,Rita de Cascia,"Marguerite Lotti (in Italian: Margherita Lotti), called Sister Rita of Cascia (in Italian: sorella Rita da Cascia) commonly simplified to Rita, born in May 1381 in Roccaporena (Papal States) and died on May 22, 1457 in Cascia (Papal States), is an Italian widow who was admitted to the Augustinian order. She is known as the advocate of “desperate causes.” Canonized in 1900, her incorrupt body remains in the Basilica of Saint Rita in Cascia.",https://fr.wikipedia.org/wiki/Rita_de_Cascia,Historic Site,,
Place de la Chapelle,Place de la Chapelle,"Place de la Chapelle is a square in the 18th arrondissement of Paris, France.",https://fr.wikipedia.org/wiki/Place_de_la_Chapelle,Historic Site,48.884776,2.359421
Square de Clignancourt,Square de Clignancourt,"Square de Clignancourt is a street in the 18th arrondissement of Paris, France.",https://fr.wikipedia.org/wiki/Square_de_Clignancourt,Historic Site,48.893578,2.347299
Porte Chaumont,Porte Chaumont,"Porte Chaumont is a gate in Paris, France, located in the America district in the 19th arrondissement of the capital.",https://fr.wikipedia.org/wiki/Porte_Chaumont,Historic Site,48.8864264,2.3941509
Square Rodin,Lycée Rodin,"The Lycée Rodin is a French secondary and higher education establishment, located at 19 rue Corvisart, in the 13th arrondissement of Paris, not far from the Gobelins factory.",https://fr.wikipedia.org/wiki/Lyc%C3%A9e_Rodin,Historic Site,,
Rue Du Pot De Fer,Rue du Pot-de-Fer,Rue du Pot-de-Fer is a street in the 5th arrondissement of Paris.,https://fr.wikipedia.org/wiki/Rue_du_Pot-de-Fer,Historic Site,48.8428892,2.3485564
Place Léon Blum,Place Léon-Blum,"Place Léon-Blum, formerly but still sometimes called Place Voltaire, is a street located in the Roquette and Saint-Ambroise districts of the 11th arrondissement of Paris, in France.",https://fr.wikipedia.org/wiki/Place_L%C3%A9on-Blum,Historic Site,48.858045,2.380503
Eglise Armenienne du Marais,Cathédrale Sainte-Croix de Paris des Arméniens,"The Sainte-Croix de Paris Cathedral of the Armenians, former Saint-Jean-Saint-François church, is a cathedral of Armenian Catholic worship located 13-15 rue du Perche, in the 3rd arrondissement of Paris in the Marais district.",https://fr.wikipedia.org/wiki/Cath%C3%A9drale_Sainte-Croix_de_Paris_des_Arm%C3%A9niens,Church,48.860903,2.36058036
Place Jules Joffrin,Place Jules-Joffrin,"Place Jules-Joffrin is a square located in the 18th arrondissement of Paris, France.",https://fr.wikipedia.org/wiki/Place_Jules-Joffrin,Historic Site,48.892499,2.344653
Église Saint-Jacques-Saint-Christophe de la Villette,Église Saint-Jacques-Saint-Christophe de la Villette,"The Saint-Jacques-Saint-Christophe de la Villette church, located 6, place de Bitche, between square Serge-Reggiani and place de Joinville, in the 19th arrondissement of Paris, is a Catholic parish church built between 1841 and 1844.",https://fr.wikipedia.org/wiki/%C3%89glise_Saint-Jacques-Saint-Christophe_de_la_Villette,Church,48.889167,2.379639
Place de Rhin et Danube,Place Rhin-et-Danube,Place Rhin-et-Danube is a street located in the America district of the 19th arrondissement of Paris.,https://fr.wikipedia.org/wiki/Place_Rhin-et-Danube,Historic Site,48.8820195,2.3931022
Place Flora Tristan,Place Flora-Tristan,Place Flora-Tristan is a street located in the Plaisance district of the 14th arrondissement of Paris.,https://fr.wikipedia.org/wiki/Place_Flora-Tristan,Historic Site,48.832318,2.32065
Place de la Porte de Saint-Cloud,Place de la Porte-de-Saint-Cloud,The Place de la Porte-de-Saint-Cloud is a thoroughfare in the Auteuil district of Paris's 16th arrondissement.,https://en.wikipedia.org/wiki/Place_de_la_Porte-de-Saint-Cloud,Historic Site,,
Place Wagram,Place de Wagram,Place de Wagram is a square in the 17th arrondissement of Paris.,https://fr.wikipedia.org/wiki/Place_de_Wagram,Historic Site,48.887375,2.304712
Laureline's Garden,Animation Digital Network,"Animation Digital Network, abbreviated ADN, formerly Anime Digital Network, is a VoD and simulcast platform born from the merger between KZPlay, belonging to Kazé, and Genzai, belonging to Kana Home Video, with the theme of broadcasting Japanese and Franco-Belgian animated series and feature films.",https://fr.wikipedia.org/wiki/Animation_Digital_Network,Historic Site,,
Place d'Iéna,Place d'Iéna,Place d'Iéna is located in the 16th arrondissement of Paris.,https://fr.wikipedia.org/wiki/Place_d%27I%C3%A9na,Historic Site,48.86473,2.29389
Place Dalida,Place Dalida,"The Place Dalida (French pronunciation: ) is a square in Montmartre, in the 18th arrondissement of Paris, named after the Italian-French singer Dalida. Many fans and tourists visit the place to pay tribute to the artist.",https://en.wikipedia.org/wiki/Place_Dalida,Historic Site,,
Porte de la Villette,Porte de la Villette,"Porte de la Villette is a gateway to Paris located in the Villette district in the 19th arrondissement of the capital. It separates Paris from Aubervilliers and Pantin (Seine-Saint-Denis). Historically, it is one of the seventeen gates opened in the walls of Thiers in the middle of the 19th century to protect Paris.",https://fr.wikipedia.org/wiki/Porte_de_la_Villette,Historic Site,48.898388,2.386341
Escaliers de Lamarck-Caulaincourt,Lamarck - Caulaincourt (métro de Paris),"Lamarck - Caulaincourt is a station on line 12 of the Paris metro, located in the 18th arrondissement of Paris.",https://fr.wikipedia.org/wiki/Lamarck_-_Caulaincourt_(m%C3%A9tro_de_Paris),Historic Site,48.889849,2.338693
Jardin Serge Gainsbourg,Jardin Serge-Gainsbourg,"The Serge-Gainsbourg Garden is a public garden in the 19th arrondissement of Paris, France.",https://fr.wikipedia.org/wiki/Jardin_Serge-Gainsbourg,Garden,48.878889,2.408611
Place du Docteur Félix Lobligeois,Place du Docteur-Félix-Lobligeois,Place du Docteur-Félix-Lexigeois is a square in the 17th arrondissement of Paris.,https://fr.wikipedia.org/wiki/Place_du_Docteur-F%C3%A9lix-Lobligeois,Historic Site,48.886663,2.317622
Église Saint-Paul Saint-Louis,Saint-Paul-Saint-Louis,"The Église Saint-Paul-Saint-Louis (French pronunciation: ) is a church on rue Saint-Antoine in the Marais quarter of Paris. The present building was constructed from 1627 to 1641 by the Jesuit architects Étienne and François Derand, on the orders of Louis XIII. It was the first church in Paris to break away entirely from the Gothic style and to use the new Baroque style of the Jesuits, and it had an important influence on Parisian religious architecture. It gives its name to Place Saint-Paul and its nearest Metro station, Saint-Paul. Next door to the church is the Lycée Charlemagne, also founded by the Jesuits.",https://en.wikipedia.org/wiki/Saint-Paul-Saint-Louis,Church,,
Pont d'Iéna,Pont d'Iéna,Pont d'Iéna (French: ; French for 'Jena Bridge') is a bridge spanning the River Seine in Paris. It links the Eiffel Tower on the Left Bank to the district of Trocadéro on the Right Bank.,https://en.wikipedia.org/wiki/Pont_d%27I%C3%A9na,Bridge,,
Place Félix Eboué,Place Félix-Éboué,"Place Félix-Éboué, previously called Place Daumesnil, is a street located in the Picpus district of the 12th arrondissement of Paris.",https://fr.wikipedia.org/wiki/Place_F%C3%A9lix-%C3%89bou%C3%A9,Historic Site,48.839815,2.395811
Place Jacques Bonsergent,Place Jacques-Bonsergent,"Place Jacques-Bonsergent is a street in the 10th arrondissement of Paris, France.",https://fr.wikipedia.org/wiki/Place_Jacques-Bonsergent,Historic Site,48.870954,2.361073
Pont Qui Bouge,Tizi Ouzou,"Tizi Ouzou (in Kabyle: ⵝⵉⵣⵉ ⵡⴻⵣⵣⵓ, Ṯizi Wezzu; in Arabic: تيزي وزو; nicknamed “the capital of Djurdjura” and “col des Genêts”) is an Algerian commune located 30 km south of the Mediterranean coast and 100 km east of the capital Algiers. It is the capital of the Wilaya of Tizi Ouzou and the Daïra of Tizi Ouzou, in Kabylia.",https://fr.wikipedia.org/wiki/Tizi_Ouzou,Historic Site,36.716667,4.05
Église Saint-Gervais Saint-Protais,Église Saint-Gervais-Saint-Protais,"Église Saint-Gervais-Saint-Protais, or Église Saint-Gervais-et-Saint-Protais, may refer to many churches around the world dedicated to the twins Saint Gervais and Saint Protais.",https://fr.wikipedia.org/wiki/%C3%89glise_Saint-Gervais-Saint-Protais,Church,,
Square Henri Collet,Square Henri-Collet,"Square Henri-Collet is a square in the 16th arrondissement of Paris, in the Auteuil district.",https://fr.wikipedia.org/wiki/Square_Henri-Collet,Historic Site,48.85181,2.27526
Rue Mallet Stevens,Rue Mallet-Stevens,Rue Mallet-Stevens is a public road in Paris inaugurated in July 1927 and located in the 16th arrondissement of Paris.,https://fr.wikipedia.org/wiki/Rue_Mallet-Stevens,Historic Site,48.85486,2.266
Banc Public,Banc public,A public bench is a bench installed in a public place. It is part of urban furniture.,https://fr.wikipedia.org/wiki/Banc_public,Historic Site,,
Église Notre-Dame-de-Bonne-Nouvelle,Église Notre-Dame-de-Bonne-Nouvelle de Paris,"The Notre-Dame-de-Bonne-Nouvelle church, located at 25, rue de la Lune, in the 2nd arrondissement of Paris, is a Catholic parish church built from 1823 to 1830.",https://fr.wikipedia.org/wiki/%C3%89glise_Notre-Dame-de-Bonne-Nouvelle_de_Paris,Church,48.869583,2.349861
FRAC Île-de-France — Le Plateau,Conseil régional d'Île-de-France,"The Île-de-France regional council is the deliberative assembly of the French region of Île-de-France. The regional council is made up of 209 regional councilors elected for 6 years and has been chaired since December 18, 2015 by Valérie Pécresse (LR).",https://fr.wikipedia.org/wiki/Conseil_r%C3%A9gional_d%27%C3%8Ele-de-France,Historic Site,,
Place de Barcelone,Place de Barcelone,Place de Barcelona is an odonym to refer to:,https://fr.wikipedia.org/wiki/Place_de_Barcelone,Historic Site,,
Église Notre-Dame-du-Travail,Église Notre-Dame-du-Travail,Notre-Dame-du-Travail Church refers to the following churches:,https://fr.wikipedia.org/wiki/%C3%89glise_Notre-Dame-du-Travail,Church,,
Porte de Champerret,Porte de Champerret,Porte de Champerret is a Paris gate in the 17th arrondissement of Paris.,https://fr.wikipedia.org/wiki/Porte_de_Champerret,Historic Site,48.885556,2.291389
L'Eglise Notre-Dame de Consolation,Chapelle Notre-Dame-de-Consolation de Paris,"The Notre-Dame-de-Consolation chapel is a chapel located at 23 rue Jean-Goujon in the Champs-Élysées district (8th arrondissement) in Paris. It is today entrusted to the Priestly Fraternity of Saint-Pie-X, by its owner, the Memorial du Bazar de la Charité association.",https://fr.wikipedia.org/wiki/Chapelle_Notre-Dame-de-Consolation_de_Paris,Historic Site,48.86556,2.306028
Cathédrale Saint-Alexandre-Nevsky,Cathédrale Saint-Alexandre-Nevski,Several cathedrals are named Saint-Alexander-Nevsky Cathedral or Saint-Alexander-Nevsky Cathedral in honor of Alexander Nevsky:,https://fr.wikipedia.org/wiki/Cath%C3%A9drale_Saint-Alexandre-Nevski,Historic Site,,
Pelouse aux Lions,Équipe du Cameroun de football,"The Cameroon football team is the national team that represents Cameroon in international men's football competitions, under the aegis of the Cameroon Football Federation (FECAFOOT). Also nicknamed the “Indomitable Lions” team.",https://fr.wikipedia.org/wiki/%C3%89quipe_du_Cameroun_de_football,Historic Site,,
Place des Antilles,Place des Antilles,"Place des Antilles is a street located in the Sainte-Marguerite district of the 11th arrondissement of Paris, France.",https://fr.wikipedia.org/wiki/Place_des_Antilles,Historic Site,48.8487353,2.3987835
Place de Varsovie,Place de Varsovie,Place de Varsovie is a street located in the Muette district and the Chaillot district of the 16th arrondissement of Paris.,https://fr.wikipedia.org/wiki/Place_de_Varsovie,Historic Site,48.8603597,2.2912085
Square de la Madone,Square de la Madone,"Square de la Madone is a square in the 18th arrondissement of Paris, in the Chapelle district.",https://fr.wikipedia.org/wiki/Square_de_la_Madone,Historic Site,48.8927,2.36148
Place de la Convention,Convention citoyenne pour le climat,"The Citizens' Convention for the Climate is an assembly of French citizens set up in October 2019 by the Economic, Social and Environmental Council, at the request of Prime Minister Édouard Philippe. This initiative brings together 150 volunteers selected at random from the French population, with the aim of designing a set of structuring measures “to achieve, in a spirit of social justice, reducing France's greenhouse gas emissions by at least 40% by 2030 compared to 1990”.",https://fr.wikipedia.org/wiki/Convention_citoyenne_pour_le_climat,Historic Site,,
Porte de Pantin,Porte de Pantin,"The Porte de Pantin is, today, a very important gate in Paris, France, located in the Villette district in the 19th arrondissement of the capital. It constitutes the main access to the town of Pantin from Paris.",https://fr.wikipedia.org/wiki/Porte_de_Pantin,Historic Site,48.889557,2.395804
American Cathedral in Paris,American Cathedral in Paris,"The American Cathedral in Paris (French: Cathédrale Américaine de Paris), formally known as the Cathedral Church of the Holy Trinity, is one of the oldest English-speaking churches in Paris. It is the gathering church for the Convocation of Episcopal Churches in Europe, and is part of the worldwide Anglican Communion. The church is located in central Paris between the Champs-Elysées and the River Seine at 23 avenue George V in the 8th arrondissement. The closest métro stations are Alma – Marceau and George V .",https://en.wikipedia.org/wiki/American_Cathedral_in_Paris,Church,,
Musée National du Sport,Musée National du Sport,"The Musée national du Sport is a national sports museum located in the Grand Stadium of Nice, France.",https://en.wikipedia.org/wiki/Mus%C3%A9e_National_du_Sport,Museum,,
Porte d'Asnières,Porte d'Asnières,The Porte d'Asnières is an important gate in Paris located in the 17th arrondissement. It owes its name to its proximity to the town of Asnières-sur-Seine.,https://fr.wikipedia.org/wiki/Porte_d%27Asni%C3%A8res,Historic Site,48.890183,2.303707
Jardin des Invalides,Hôtel des Invalides,"The Hôtel des Invalides is a Parisian monument, located in the 7th arrondissement, whose construction was ordered by Louis XIV by the royal edict of February 24, 1670, to accommodate the invalids of his armies. Remaining faithful to this mission, in addition to the National Institution for Invalids, it houses the Saint-Louis des Invalides cathedral, several museums and a military necropolis including the tomb of Napoleon I. Seat of high military authorities such as the military governor of Paris, it also brings together a number of organizations dedicated to the memory of veterans and the support of wounded soldiers.",https://fr.wikipedia.org/wiki/H%C3%B4tel_des_Invalides,Monument / Landmark,48.86,2.311944
Jardin de la Cité Prost,Cité Prost,"The Prost city is a former road in the 11th arrondissement of Paris, France, closed in 2006.",https://fr.wikipedia.org/wiki/Cit%C3%A9_Prost,Historic Site,48.852228,2.385577
Place Raoul Dautry,Place Raoul-Dautry,Place Raoul-Dautry is a square in the east of the 15th arrondissement of Paris.,https://fr.wikipedia.org/wiki/Place_Raoul-Dautry,Historic Site,48.841667,2.321111
Place Georges Pompidou,Place Georges-Pompidou,Place Georges-Pompidou is a square located in the 4th arrondissement of Paris.,https://fr.wikipedia.org/wiki/Place_Georges-Pompidou,Historic Site,48.860734,2.351659
Square Van Vollenhoven,Square Van-Vollenhoven,Square Van-Vollenhoven is a green space located in the Bel-Air district of the 12th arrondissement of Paris.,https://fr.wikipedia.org/wiki/Square_Van-Vollenhoven,Historic Site,48.834618,2.406746
Église Saint-Séverin,"Saint-Séverin, Paris","The Church of Saint-Séverin (French: Église Saint-Séverin, pronounced ) is a Catholic church in the 5th arrondissement, or Latin Quarter, of Paris, on the lively tourist street Rue Saint-Séverin. It was constructed beginning in 1230, then, after a fire, rebuilt and enlarged in the 15th to 17th centuries in the Flamboyant Gothic style. It was the parish church for students at the University of Paris, and is one of the oldest churches that remains standing on the Left Bank.","https://en.wikipedia.org/wiki/Saint-S%C3%A9verin,_Paris",Church,,
Rond-Point des Champs-Élysées — Marcel Dassault,Rond-point des Champs-Élysées-Marcel-Dassault,"The Champs-Élysées-Marcel-Dassault roundabout, formerly but still sometimes referred to in common usage as the Champs-Élysées roundabout, is a square in the 8th arrondissement of Paris, capital of France.",https://fr.wikipedia.org/wiki/Rond-point_des_Champs-%C3%89lys%C3%A9es-Marcel-Dassault,Historic Site,48.86897,2.31009
Square Alberto Giacometti,Square Alberto-Giacometti,The Alberto-Giacometti square is a square in the 14th arrondissement of Paris.,https://fr.wikipedia.org/wiki/Square_Alberto-Giacometti,Historic Site,48.83194,2.31965
Cimetière de Passy,Passy Cemetery,"Passy Cemetery (French: Cimetière de Passy) is a small cemetery in Passy, in the 16th arrondissement of Paris, France.",https://en.wikipedia.org/wiki/Passy_Cemetery,Cemetery,,
Place Rodin,Place Rodin,Place Rodin is a street located in the Auteuil district of the 16th arrondissement of Paris.,https://fr.wikipedia.org/wiki/Place_Rodin,Historic Site,48.8533097,2.2709614
Place Pinel,Place Pinel,The Place Pinel (English: Pinel Square) is a square and street in the 13th arrondissement of Paris.,https://en.wikipedia.org/wiki/Place_Pinel,Historic Site,,
