input_name,wiki_name,wiki_description,wiki_url,category,lat,lon
Cité-Refuge De L'Armée Du Salut Le Corbusier,Le Corbusier,"Charles-Édouard Jeanneret-Gris, known as Le Corbusier, is a Swiss architect, town planner, designer, painter, sculptor, man of letters, poet and theorist naturalized French in 1930, born October 6, 1887 in La Chaux-de-Fonds in Switzerland and died August 27, 1965 in Roquebrune-Cap-Martin in France. He is one of the main representatives of the modern movement with, among others, Ludwig Mies van der Rohe, Walter Gropius, Alvar Aalto and Theo van Doesburg. He also rubbed shoulders with Robert Mallet-Stevens. Le Corbusier is known for being the inventor of the “housing unit”, a concept on which he began to work in the 1920s, an expression of theoretical reflection on collective housing. “The conforming size housing unit” (name given by Le Corbusier) will only be built during the reconstruction after the Second World War, in five examples, all different, in Marseille, Briey-en-Forêt, Rezé, Firminy and Berlin. It will become a solution to post-war housing problems. Its design envisages in the same building all the collective facilities necessary for life — daycare, laundry, swimming pool, school, shops, library, post office, meeting places. The architectural work of Le Corbusier bringing together seventeen sites (including ten in France, the others being spread over three continents) was classified as a UNESCO world heritage site on July 17, 2016. A European cultural itinerary entitled “Destinations Le Corbusier: architectural walks” was created at the beginning of May 2019. The work and thoughts of Le Corbusier were particularly influential on post-war generations of architects and widely disseminated, before entering, with the period of postmodernism, into a phase of significant and regular contestation,,,. It replaces the exterior load-bearing walls with reinforced concrete pillars placed inside the buildings. From then on, the facades no longer carry the upper floors, it is possible to clad them with light partitions and multiple, very large windows. He then plays with shapes and spaces, without having to take into account any alignment linked to the weights of the upper floors, this constraint having disappeared. Its main strength was to significantly reduce construction times. He was the first to use basic techniques and materials, making it possible to build an entire house, on several floors, in a few days, like his first complex, the Cité Frugès de Pessac, in the near suburbs of Bordeaux, a city made up of fifty small buildings and constructed at the rate of approximately one new building each week.",https://fr.wikipedia.org/wiki/Le_Corbusier,Historic Site,,
Parc de la Cité Internationale Universitaire,Cité internationale universitaire de Paris,"The Cité international universitaire de Paris (CiuP) is a foundation which, within its 40 Parisian houses, welcomes nearly 6,000 students, researchers, artists and high-level athletes from around the world.",https://fr.wikipedia.org/wiki/Cit%C3%A9_internationale_universitaire_de_Paris,Historic Site,48.817127,2.338224
Église Saint-Georges de la Villette,Église Saint-Georges de la Villette,The Saint-Georges de la Villette church is a Catholic church located at 112-114 avenue Simon-Bolivar in the 19th arrondissement of Paris.,https://fr.wikipedia.org/wiki/%C3%89glise_Saint-Georges_de_la_Villette,Church,48.879472,2.37475
Église Saint-Germain-de-Charonne,Église Saint-Germain de Charonne,"The Saint-Germain de Charonne church, a Catholic religious building in the 20th arrondissement of Paris.",https://fr.wikipedia.org/wiki/%C3%89glise_Saint-Germain_de_Charonne,Church,48.860167,2.4039694
Meadows,Meadow,"A meadow (/ˈmɛdoʊ/ MED-oh) is an open habitat or field, vegetated by grasses, herbs, and other non-woody plants. Trees or shrubs may sparsely populate meadows, as long as they maintain an open character. Meadows can occur naturally under favourable conditions but are often artificially created from cleared shrub or woodland for the production of hay, fodder or livestock. Meadow habitats as a group are characterized as semi-natural grasslands, meaning that they are largely composed of species native to the region, with only limited human intervention.",https://en.wikipedia.org/wiki/Meadow,Historic Site,,
Temple Boudhiste,Temple bouddhiste,"A Buddhist temple or Buddhist temple is a place of worship intended for practitioners of Buddhism. The stūpa, the chörten, the pagoda and the wat are examples of architectural structures typical of these temples.",https://fr.wikipedia.org/wiki/Temple_bouddhiste,Temple,,
Place Salvador Allende,Place Salvador-Allende,"Place Salvador-Allende (called Place de Santiago-du-Chili until September 11, 2003) is a square in the 7th arrondissement of Paris.",https://fr.wikipedia.org/wiki/Place_Salvador-Allende,Historic Site,48.858027,2.310085
Eglise Evangelique Allemande,Église protestante en Allemagne,"The Protestant Church in Germany (German: Evangelische Kirche in Deutschland, EKD) is the federal association of Lutheran, Reformed and United Protestant churches in Germany. It brings together a community of 20 autonomous and regional churches. The EKD, like its members, the regional churches, is recognized as a public establishment of worship. Its headquarters is in Hanover. All regional churches of the EKD are part of the Communion of Protestant Churches in Europe.",https://fr.wikipedia.org/wiki/%C3%89glise_protestante_en_Allemagne,Church,,
Place Armand Carrel,Place Roger-Madec,Place Roger-Madec is a street located in the Combat district of the 19th arrondissement of Paris.,https://fr.wikipedia.org/wiki/Place_Roger-Madec,Historic Site,48.882581,2.382133
Porte De Vitry,Porte de Vitry,"The Porte de Vitry is a gate in Paris, France located in the Gare district south of the 13th arrondissement.",https://fr.wikipedia.org/wiki/Porte_de_Vitry,Historic Site,48.824167,2.376944
Eglise Du Sacré Coeur Colombes,Sacré-Cœur de Jésus,"The Sacred Heart is a devotion to the heart of Jesus Christ, as a symbol of the divine love by which God took on human nature and gave his life for men. The theme of the Sacred Heart is particularly present in the Catholic Church as well as, on a lesser scale, in the Anglican Church and in certain Lutheran Churches.",https://fr.wikipedia.org/wiki/Sacr%C3%A9-C%C5%93ur_de_J%C3%A9sus,Church,,
Square Du Jeu De Boules,Drakengard (jeu vidéo),"Drakengard is a beat them all released on PlayStation 2 in 2003 (in Japan), published by Take-Two and by Square Enix, developed by Cavia.",https://fr.wikipedia.org/wiki/Drakengard_(jeu_vid%C3%A9o),Historic Site,,
Sainte Rita,Sainte-Rita,"Sainte-Rita (French pronunciation: ) is a municipality in Les Basques Regional County Municipality in Quebec, Canada.",https://en.wikipedia.org/wiki/Sainte-Rita,Historic Site,,
Passerelle Des Meuniers,Rue des Meuniers,Rue des Meuniers is a street located in the 12th arrondissement of Paris in France.,https://fr.wikipedia.org/wiki/Rue_des_Meuniers,Historic Site,48.834585,2.396859
Théâtre de Verdure,Théâtre de verdure,"A green theater is an artistically landscaped setting allowing you to attend live shows or cinema screenings in the open air. Often inspired by ancient amphitheaters in the semi-circular arrangement of stands or chairs oriented towards a stage space, it can be placed in a public garden surrounded by high hedges or fit more harmoniously into the natural environment. In the case of an aquatic environment, we speak of water theater.",https://fr.wikipedia.org/wiki/Th%C3%A9%C3%A2tre_de_verdure,Garden,,
Eglise Orthodoxe de Saint-Seraphin-de-Sarov,Séraphin de Sarov,"Seraphim or Seraphim of Sarov (in Russian: Серафим Саровский), born Prokhore Isidorovitch Mochnin (in Russian: Про́хор Исидо́рович Мошни́н), born in Kursk on July 19, 1754 (or 1759) and died in the Sarov monastery on January 2, 1833, is an Orthodox saint.",https://fr.wikipedia.org/wiki/S%C3%A9raphin_de_Sarov,Historic Site,,
Quais de Jussieu,Campus Pierre-et-Marie-Curie (Jussieu),"The Pierre-et-Marie-Curie campus, named from its creation until 2019 Jussieu campus, located in the Saint-Victor district of the 5th arrondissement of Paris, is the main campus of the faculty of science and engineering of Sorbonne University.",https://fr.wikipedia.org/wiki/Campus_Pierre-et-Marie-Curie_(Jussieu),Historic Site,48.84697,2.35633
Place de Torcy,Place de Torcy,"Place de Torcy is a square in the 18th arrondissement of Paris, France.",https://fr.wikipedia.org/wiki/Place_de_Torcy,Historic Site,48.891346,2.361071
Passage des Soupirs,Passage des Soupirs,"Passage des Soupirs is a road in the 20th arrondissement of Paris, France.",https://fr.wikipedia.org/wiki/Passage_des_Soupirs,Historic Site,48.868796,2.396473
Centre Paroissial,Œuvre des Chantiers du Cardinal,"L'Œuvre des Chantiers du Cardinal is an association created in 1931 by Cardinal Verdier to promote the construction and maintenance of Catholic churches in Paris and the Paris region. The financing provided by the Chantiers du Cardinal applies to buildings constructed after the law of separation of Churches and State of 1905, that is to say to buildings owned by the dioceses.",https://fr.wikipedia.org/wiki/%C5%92uvre_des_Chantiers_du_Cardinal,Church,,
Église Notre-Dame-des-Otages,Église Notre-Dame-des-Otages de Paris,"The Notre-Dame-des-Otages church is a Catholic parish church located at no. 81, rue Haxo in the 20th arrondissement of Paris.",https://fr.wikipedia.org/wiki/%C3%89glise_Notre-Dame-des-Otages_de_Paris,Church,48.8742306,2.4030528
Notre-Dame D'Espérance,Basilique Notre-Dame-d'Espérance de Charleville-Mézières,"The Notre-Dame-d'Espérance basilica of Charleville-Mézières is a minor basilica of the Catholic Church, this title given by Pius XII in 1946, located in Charleville-Mézières, in the Ardennes department. This Gothic style church, built from 1499, is lit by an astonishing array of modern stained glass windows made between 1954 and 1979 on the designs of the painter René Dürrbach.",https://fr.wikipedia.org/wiki/Basilique_Notre-Dame-d%27Esp%C3%A9rance_de_Charleville-M%C3%A9zi%C3%A8res,Church,49.76125,4.716
Place Paul Verlaine,Place Paul-Verlaine,Place Paul-Verlaine is a street located in the Maison-Blanche district of the 13th arrondissement of Paris.,https://fr.wikipedia.org/wiki/Place_Paul-Verlaine,Historic Site,48.8276804,2.3526185
Jardin Debergue - Rendez-Vous,Jardin Solange-Faladé,"The Solange-Faladé garden, formerly the Debergue - Rendez-Vous garden, is a green space in the 12th arrondissement of Paris, in the Bel-Air district.",https://fr.wikipedia.org/wiki/Jardin_Solange-Falad%C3%A9,Garden,48.84667,2.40444
Porte de Châtillon,Porte de Châtillon,"Porte de Châtillon is a gate in Paris, France, located in the 14th arrondissement.",https://fr.wikipedia.org/wiki/Porte_de_Ch%C3%A2tillon,Historic Site,48.8245293,2.3192151
Place Bienvenüe,Place Bienvenüe,Place Bienvenüe is a street located in the Necker district in the 15th arrondissement of Paris.,https://fr.wikipedia.org/wiki/Place_Bienven%C3%BCe,Historic Site,48.8418879,2.3205095
Église Notre Dame de l'Espérance,Église Notre-Dame-d'Espérance,"Several churches in France have been named ""Notre-Dame-d'Espérance church"" or ""Notre-Dame-de-l'Espérance church"":",https://fr.wikipedia.org/wiki/%C3%89glise_Notre-Dame-d%27Esp%C3%A9rance,Church,,
Square Caulaincourt,Square Caulaincourt,"Square Caulaincourt is a public road in the 18th arrondissement of Paris, France.",https://fr.wikipedia.org/wiki/Square_Caulaincourt,Historic Site,48.890094,2.335729
Rue Orfila,Rue Orfila,Rue Orfila is a street located in the Père-Lachaise district of the 20th arrondissement of Paris.,https://fr.wikipedia.org/wiki/Rue_Orfila,Historic Site,48.8670191,2.3979863
Église Notre-Dame-de-l'Assomption de Passy,Église Notre-Dame-de-l'Assomption de Passy,"The Notre-Dame-de-l'Assomption church in Passy is a church located on Place de l'Église-de-l'Assomption, accessible by 88 and 90, rue de l'Assomption in the 16th arrondissement of Paris.",https://fr.wikipedia.org/wiki/%C3%89glise_Notre-Dame-de-l%27Assomption_de_Passy,Church,48.855583,2.2665
Les Maisons Rouges,Maison-Rouge,Maison-Rouge is a French commune located in the department of Seine-et-Marne in the Île-de-France region.,https://fr.wikipedia.org/wiki/Maison-Rouge,Historic Site,48.5594,3.1514
Église Notre-Dame de la Gare,Église Notre-Dame-de-la-Gare de Paris,"The Notre-Dame de la Gare church is a parish church located on Place Jeanne-d'Arc in the 13th arrondissement of Paris, France. It takes its name from the district in which it is located, the Gare district. It was consecrated on November 11, 1859.",https://fr.wikipedia.org/wiki/%C3%89glise_Notre-Dame-de-la-Gare_de_Paris,Church,48.82972,2.36833
Centre de Loisir Vincennes Nogent,Nogent-sur-Marne,Nogent-sur-Marne (pronounced) is a French commune located in the Val-de-Marne department in the Île-de-France region.,https://fr.wikipedia.org/wiki/Nogent-sur-Marne,Historic Site,48.8367,2.4825
Église Saint-Gabriel,Église Saint-Gabriel de Paris,"The Saint-Gabriel church in Paris, of Catholic worship, is located rue des Pyrénées in the 20th arrondissement of Paris.",https://fr.wikipedia.org/wiki/%C3%89glise_Saint-Gabriel_de_Paris,Church,48.848583,2.406083
Barrière du Trône,Barrière du Trône,"The Barrière du Trône (Trône Gate) was a toll barrier (barrière d’octroi) in the wall of the Fermiers généraux (the tax farmers’ enclosure) that was built around Paris in the 1780s. It was part of a wall that, just prior to the French Revolution, surrounded Paris. The purpose of the wall, which was designed by Claude Nicolas Ledoux, was to facilitate the collection of municipal duties on merchandise entering Paris by reducing smuggling and fraud. It is located in eastern Paris and straddles the 11th arrondissement and the 12th arrondissement. The barrier takes its name from its location on the former Place du Trône, now called place de la Nation.",https://en.wikipedia.org/wiki/Barri%C3%A8re_du_Tr%C3%B4ne,Historic Site,,
Mosquée Omar Ibn El Khattab,Omar ibn al-Khattâb,"Omar ibn al-Khattâb (Arabic: عُمَر إِبْن ٱلْخَطّاب‎), born in 584 in Mecca and murdered on November 7, 644 in Medina, is a companion of Muhammad, the prophet of Islam, and is part of the Banu Adi clan (in) of the tribe Quraysh.",https://fr.wikipedia.org/wiki/Omar_ibn_al-Khatt%C3%A2b,Historic Site,,
Eglise Presbyterienne Coréenne De Mok-yang,Résultats de la recherche,,https://fr.wikipedia.org/w/index.php?go=Go&search=Eglise%20Presbyterienne%20Cor%C3%A9enne%20De%20Mok-yang&title=Sp%C3%A9cial:Recherche&ns0=1,Historic Site,,
Square Courteline,Square Courteline,Square Courteline is a small municipal green space in the 12th arrondissement of Paris.,https://fr.wikipedia.org/wiki/Square_Courteline,Historic Site,48.8443064,2.402004
Esplanade de la Bibliothèque Nationale de France,Bibliothèque nationale de France,"The National Library of France (BnF or BNF), so called since 1994, is the national library of the French Republic, inaugurated under this new name on March 30, 1995 by the President of the Republic, François Mitterrand. Heiress to the royal collections built up since the Middle Ages, it has one of the richest funds in the world.",https://fr.wikipedia.org/wiki/Biblioth%C3%A8que_nationale_de_France,Historic Site,48.833611111111,2.3758333333333
ノートルダム寺院,Résultats de la recherche,,https://fr.wikipedia.org/w/index.php?go=Go&search=%E3%83%8E%E3%83%BC%E3%83%88%E3%83%AB%E3%83%80%E3%83%A0%E5%AF%BA%E9%99%A2&title=Sp%C3%A9cial:Recherche&ns0=1,Historic Site,,
Pont des Invalides,Pont des Invalides,The Pont des Invalides (French pronunciation: ) is the lowest bridge traversing the Seine in Paris.,https://en.wikipedia.org/wiki/Pont_des_Invalides,Bridge,,
Paroisse Saint Hippolyte,Ancienne église Saint-Hippolyte de Paris,The former Saint-Hippolyte church in Paris is a former Catholic place of worship in the Faubourg Saint-Marcel in the current Croulebarbe district of the 13th arrondissement of Paris.,https://fr.wikipedia.org/wiki/Ancienne_%C3%A9glise_Saint-Hippolyte_de_Paris,Church,48.836573,2.35075
Deutsche Evangelische Kirche,German Evangelical Church,The German Evangelical Church (German: Deutsche Evangelische Kirche) was a successor to the German Protestant Church Confederation from 1933 until 1945. It is also known in English as the Protestant Reich Church (German: Evangelische Reichskirche) and colloquially as the Reich Church (German: Reichskirche).,https://en.wikipedia.org/wiki/German_Evangelical_Church,Church,,
Kiosque à musique,Kiosque à musique,"A bandstand is a construction for entertainment, typical of the 19th and early 20th century layout of towns and parks, very open, symmetrical in relation to the central axis (panoptic shape) and polygonal or, more rarely, circular in plan.",https://fr.wikipedia.org/wiki/Kiosque_%C3%A0_musique,Park,,
La Cheminee Noire,Sur les chemins noirs (livre),"On the Black Paths is an autobiographical story by Sylvain Tesson published on October 13, 2016.",https://fr.wikipedia.org/wiki/Sur_les_chemins_noirs_(livre),Historic Site,,
Square Trébois,Rue Jean-Jaurès (Levallois-Perret),Rue Jean-Jaurès is a road in the French commune of Levallois-Perret.,https://fr.wikipedia.org/wiki/Rue_Jean-Jaur%C3%A8s_(Levallois-Perret),Historic Site,48.89132,2.29249
Porte de Clignancourt,Porte de Clignancourt station,"Porte de Clignancourt (French pronunciation: ) is a station of the Paris Métro, the northern terminus of line 4, situated in the 18th Arrondissement.",https://en.wikipedia.org/wiki/Porte_de_Clignancourt_station,Historic Site,,
Photoquai,Photoquai,Photoquai is a biennial exhibition created in 2007 by the Quai Branly museum and dedicated to non-Western photography. The last edition took place in 2015.,https://fr.wikipedia.org/wiki/Photoquai,Museum,,
Église Saint-Laurent,"Saint-Laurent, Paris","Saint-Laurent (French pronunciation:  ⓘ) is a Catholic church in the 10th arrondissement of Paris at 68 bis Boulevard de Magenta. A series of churches occupied the site since the 10th century. It is named for Saint Lawrence, an early Christian martyr who was executed in Rome by the Roman Emperor Valerian in 258 AD. It has been listed since 2016 as a monument historique by the French Ministry of Culture.","https://en.wikipedia.org/wiki/Saint-Laurent,_Paris",Monument / Landmark,,
Porte de Choisy,Quartier asiatique,"The Quartier asiatique (French pronunciation: , Asian Quarter), also called Triangle de Choisy () or Petite Asie (; Chinese: 巴黎唐人街, Vietnamese: Phố Tàu Paris) is the largest commercial and cultural center for the population of East Asian and Southeast Asian origin of Paris. It is located in the southeast of the 13th arrondissement in an area that contains many high-rise apartment buildings. Despite its status as a ""Chinatown"", the neighborhood also contains significant Vietnamese, Laotian and Cambodian populations.",https://en.wikipedia.org/wiki/Quartier_asiatique,Historic Site,,
Villa Flore,Villa Flore,"Villa Flore is a lane in the 16th arrondissement of Paris, France.",https://fr.wikipedia.org/wiki/Villa_Flore,Historic Site,48.849902,2.266327
Place de la Bourse,"Place de la Bourse, Bordeaux","The Place de la Bourse (French pronunciation: , ""Stock Exchange Square"") is a square in Bordeaux, France, and one of the city's most recognisable sights. Built from 1730 to 1775 along the river Garonne, it was a multi-building development designed by the architect Jacques Gabriel and his son Ange-Jacques Gabriel. It is within the historic part of the city that has been recognized on the UNESCO World Heritage List as ""an outstanding urban and architectural ensemble"" of the 18th century.","https://en.wikipedia.org/wiki/Place_de_la_Bourse,_Bordeaux",Historic Site,,
Rue du Chateau des Rentiers,Rue du Château-des-Rentiers,Rue du Château-des-Rentiers is a street located in the Gare district of the 13th arrondissement of Paris.,https://fr.wikipedia.org/wiki/Rue_du_Ch%C3%A2teau-des-Rentiers,Historic Site,48.8275575,2.368104
Le Tabernacle,Tabernacle (Bible),"The original Tabernacle is the tent that housed the Ark of the Covenant in the time of Moses. Its chief architect, appointed directly by God to Moses, is Béséléel. In the Hebrew Bible and the Old Testament, the tabernacle was to be the temporary habitation of God, his residence and the rallying center of his people.",https://fr.wikipedia.org/wiki/Tabernacle_(Bible),Historic Site,,
Église Des Soldats,Tombeau de Napoléon Ier aux Invalides,"The tomb of Napoleon I is located in the Hôtel des Invalides, a building designed in the 17th century by Libéral Bruand and Jules-Hardouin Mansart, then transformed into a pantheon of military glories by Napoleon when he transferred the tomb of Marshal de Turenne there. If Napoleon died on May 5, 1821 on the island of Saint Helena, the project for his tomb in Les Invalides only began after the announcement, in May 1840, of the return of the body (or “ashes”) of the Emperor. This announcement was followed, on June 10 of the same year, by the vote of a law fixing the place of burial. Submitted to the competition, the construction of the monument ultimately fell to Louis Visconti. Napoleon's body returned to his tomb on April 2, 1861, almost twenty years after the decision to bury him at Les Invalides.",https://fr.wikipedia.org/wiki/Tombeau_de_Napol%C3%A9on_Ier_aux_Invalides,Monument / Landmark,48.855242,2.312514
Carrefour Saint-Placide/Rennes,Rue de Rennes (Paris),Rue de Rennes is a street in the 6th arrondissement of Paris. It is a major shopping artery on the left bank of the capital.,https://fr.wikipedia.org/wiki/Rue_de_Rennes_(Paris),Historic Site,48.849485,2.329209
Esplanade Saint-Louis,Esplanade Saint-Louis,"Esplanade Saint-Louis is a street in the 12th arrondissement of Paris, France.",https://fr.wikipedia.org/wiki/Esplanade_Saint-Louis,Historic Site,48.839427,2.435363
Place d'Alleray,Place d'Alleray,Place d'Alleray is a street located in the Saint-Lambert district in the 15th arrondissement of Paris.,https://fr.wikipedia.org/wiki/Place_d%27Alleray,Historic Site,48.8363342,2.306551
Place Falguière,Place Falguière,Place Falguière is a street located in the Necker district and the Saint-Lambert district of the 15th arrondissement of Paris.,https://fr.wikipedia.org/wiki/Place_Falgui%C3%A8re,Historic Site,48.8363059,2.3101884
Rotonde de la Villette,Wall of the Fermiers généraux,"The wall of the Fermiers généraux (French: mur des Fermiers généraux, pronounced ) was one of the several city walls of Paris built between the early Middle Ages and the mid 19th century. The purpose of the wall of the Fermiers généraux was to facilitate collection of municipal taxes on merchandise entering Paris.",https://en.wikipedia.org/wiki/Wall_of_the_Fermiers_g%C3%A9n%C3%A9raux,Historic Site,,
Pavillon Carré de Baudouin,Pavillon Carré de Baudouin,"The Pavillon Carré de Baudouin is an 18th century building located rue de Ménilmontant in the 20th arrondissement of Paris, which was converted into a cultural space open to the public in June 2007. The place is managed by the city of Paris and the town hall of the 20th arrondissement of Paris and entry is free.",https://fr.wikipedia.org/wiki/Pavillon_Carr%C3%A9_de_Baudouin,Historic Site,48.87,2.39389
Statue Charles de Gaulle,Statue Charles de Gaulle à Varsovie,"The statue of Charles de Gaulle in Warsaw is located in front of the Banking and Financial Center (pl) building, at the Charles de Gaulle roundabout in the Śródmieście district of Warsaw. It was installed there on May 15, 2005. It is a copy of the monument erected in 2000 on the Avenue des Champs-Élysées in Paris.",https://fr.wikipedia.org/wiki/Statue_Charles_de_Gaulle_%C3%A0_Varsovie,Monument / Landmark,52.2315,21.0215
Le Château D'Ingres,Jean-Auguste-Dominique Ingres,"Jean-Auguste-Dominique Ingres (/ʒɑ̃ ogyst dɔminik ɛ̃gʁ/), born August 29, 1780 in Montauban and died January 14, 1867 in Paris, is a French painter who was also an excellent musician - he was second violin with the Toulouse Orchestra - which led him to become friends with the greatest violinists of his time, Niccolo Paganini and Pierre Baillot.",https://fr.wikipedia.org/wiki/Jean-Auguste-Dominique_Ingres,Historic Site,,
Parc Avenue Foch,Ferdinand Foch,"Ferdinand Foch, born October 2, 1851 in Tarbes (Hautes-Pyrénées) and died March 20, 1929 in Paris (Seine), is a French soldier. Trained at the École Polytechnique then at the École de l'Artillery, he reached the rank of major general and distinguished himself as generalissimo of the Allied Forces on the Western Front during the First World War in 1918. He was elevated to the rank of Marshal of France the same year.",https://fr.wikipedia.org/wiki/Ferdinand_Foch,Historic Site,,
Villa Des Lilas,Villa des Lilas,"The Villa des Lilas is a lane in the 19th arrondissement of Paris, France.",https://fr.wikipedia.org/wiki/Villa_des_Lilas,Historic Site,48.880031,2.394616
Place d'Aligre,Place d'Aligre,"Place d'Aligre is located in the middle of Rue d'Aligre, in the 12th arrondissement of Paris, France.",https://fr.wikipedia.org/wiki/Place_d%27Aligre,Historic Site,48.848844,2.378333
Mosquee Foyer gergovie,Liste des mosquées de Paris,"Paris has around twenty mosques, as well as numerous prayer rooms. Some districts have neither mosque nor prayer room. For mosques located outside Paris, see the List of mosques in France page.",https://fr.wikipedia.org/wiki/Liste_des_mosqu%C3%A9es_de_Paris,Mosque,,
