input_name,wiki_name,wiki_description,wiki_url,category,lat,lon
Basilique Cathédrale de Saint-Denis,Basilique Saint-Denis,The Saint-Denis Basilica of Saint-Denis is a Gothic style church located in the center of the city of Saint-Denis.,https://fr.wikipedia.org/wiki/Basilique_Saint-Denis,Church,48.935556,2.359722
Oppidum et musée archéologique d'Ensérune,Oppidum d'Ensérune,"The Ensérune oppidum is an archaeological site comprising the remains of an ancient village, located on a hill in the commune of Nissan-lez-Enserune, in the department of Hérault (France). This village was occupied between the 6th century BC. BC (Iron Age) and the 1st century AD. Its position at the top of a hill earned it the title of oppidum.",https://fr.wikipedia.org/wiki/Oppidum_d%27Ens%C3%A9rune,Historic Site,43.30972,3.11056
Château d'Assier,Château d'Assier,"The Château d'Assier is located in Assier, in the Lot department of the Occitanie region of south-west France. It is an example of the diffusion of Renaissance château architecture from the Loire Valley into other parts of France.",https://en.wikipedia.org/wiki/Ch%C3%A2teau_d%27Assier,Historic Site,,
Cathédrale Saint-Lazare d'Autun,Autun Cathedral,"The Cathedral of Saint Lazarus of Autun (French: Cathédrale Saint-Lazare d'Autun), commonly known as Autun Cathedral, is a Roman Catholic cathedral in Autun and a national monument of France. Famous for its Cluniac inspiration and its Romanesque sculptures by Gislebertus, it is a highlight of Romanesque art in Burgundy. It is the seat of the Roman Catholic Diocese of Autun and its Bishop. The Bishop of Autun set forth the construction of St. Lazarus Cathedral as a result of the large movement of pilgrims travelling to Vezelay as they progressed on the pilgrimage route to Santiago de Compostela.",https://en.wikipedia.org/wiki/Autun_Cathedral,Monument / Landmark,,
Château d'Angers,Château d'Angers,"The Château d'Angers is a castle in the city of Angers in the Loire Valley, in the département of Maine-et-Loire, in France. Founded in the 9th century by the Counts of Anjou, it was expanded to its current size in the 13th century. It is located overhanging the River Maine. It is a listed historical monument since 1875. Now open to the public, the Château d'Angers is home of the Apocalypse Tapestry.",https://en.wikipedia.org/wiki/Ch%C3%A2teau_d%27Angers,Monument / Landmark,,
Colonne de la Grande Armée,Column of the Grande Armée,"The Column of the Grande Armée (French - Colonne de la grande Armée or Colonne Napoléone) is a 53 metre high Corinthian order triumphal column (modelled on Trajan's Column and other triumphal columns in Rome) on the Rue Napoleon in Wimille, near Boulogne-sur-Mer, France.",https://en.wikipedia.org/wiki/Column_of_the_Grande_Arm%C3%A9e,Historic Site,,
Monastère royal de Brou,Monastère royal de Brou,"The royal monastery of Brou is a religious complex located in Bourg-en-Bresse in the Ain department, in the Auvergne-Rhône-Alpes region.",https://fr.wikipedia.org/wiki/Monast%C3%A8re_royal_de_Brou,Historic Site,46.196,5.2369
Alignements de Carnac,Carnac stones,"The Carnac stones (Breton: Steudadoù Karnag) are an exceptionally dense collection of megalithic sites near the south coast of Brittany in northwestern France, consisting of stone alignments (rows), dolmens (stone tombs), tumuli (burial mounds) and single menhirs. More than 3,000 prehistoric standing stones were hewn from local granite and erected by the pre-Celtic people of Brittany and form the largest such collection in the world. Most of the stones are within the Breton municipality of Carnac, but some to the east are within neighboring La Trinité-sur-Mer. The stones were erected at some stage during the Neolithic period, probably around 3300 BC, but some may date to as early as 4500 BC.",https://en.wikipedia.org/wiki/Carnac_stones,Historic Site,,
Cairn de Barnenez,Barnenez,"The Cairn of Barnenez (also: Barnenez Tumulus, Barnenez Mound; in Breton Karn Barnenez; in French: Cairn de Barnenez or Tumulus de Barnenez) is a Neolithic monument located near Plouezoc'h, on the Kernéléhen peninsula in northern Finistère, Brittany, France. It dates to the early Neolithic, around 4000 BC. Along with the Tumulus of Bougon and Locmariaquer megaliths, also located in Great West France, it is one of the earliest megalithic monuments in Europe and one of the oldest man-made structures in the world. It is also remarkable for the presence of megalithic art.",https://en.wikipedia.org/wiki/Barnenez,Monument / Landmark,,
Village fortifié de Mont-Dauphin,Fort du Mont-Dauphin,"The Mont-Dauphin fort is a fortified complex, part of the Vauban fortifications listed by UNESCO, and classified as a historic monument.",https://fr.wikipedia.org/wiki/Fort_du_Mont-Dauphin,Monument / Landmark,44.6697,6.6241
Château et remparts de la Cité de Carcassonne,Cité de Carcassonne,"The City of Carcassonne is a medieval architectural ensemble located in the French city of Carcassonne in the Aude department, Occitanie region. It is located on the right bank of the Aude, southeast of the current city. This fortified medieval city, whose origins date back to the Gallo-Roman period, owes its fame to its double enclosure, reaching almost 3 km in length and comprising fifty-two towers, which dominates the Aude valley. The City also includes a castle (the count’s castle) and a basilica (the Saint-Nazaire basilica).",https://fr.wikipedia.org/wiki/Cit%C3%A9_de_Carcassonne,Historic Site,43.20667,2.36361
Château de Vincennes,Château de Vincennes,"The Château de Vincennes (French pronunciation: ) is a former fortress and royal residence next to the town of Vincennes, on the eastern edge of Paris, alongside the Bois de Vincennes. It was largely built between 1361 and 1369, and was a preferred residence, after the Palais de la Cité, of French kings from the 14th to 16th century. It is particularly known for its ""donjon"" or keep, a fortified central tower (the tallest in Europe) built in the 14th century and for the chapel, Sainte-Chapelle de Vincennes, begun in 1379 but not completed until 1552, which is an exceptional example of Flamboyant Gothic architecture. Because of its fortifications, the château was often used as a royal sanctuary in times of trouble and as a prison and military headquarters. The chapel was listed as an historic monument in 1853 and the keep was listed in 1913. Most of the building is now open to the public.",https://en.wikipedia.org/wiki/Ch%C3%A2teau_de_Vincennes,Monument / Landmark,,
Tour Pey-Berland,Tour Pey-Berland,"The Tour Pey-Berland (Pey Berland Tower), named for its patron Pey Berland, is the separate bell tower of the Bordeaux Cathedral, in Bordeaux at the Place Pey Berland.",https://en.wikipedia.org/wiki/Tour_Pey-Berland,Historic Site,,
Hôtel de Sully,Hôtel de Sully,"The Hôtel de Sully (French pronunciation: ) is a Louis XIII style hôtel particulier, or private mansion, located at 62 Rue Saint-Antoine in the Marais, 4th arrondissement, Paris, France. Built at the beginning of the 17th century, it is nowadays the seat of the Centre des monuments nationaux, the French national organization responsible for national heritage sites. It has been listed since 1862 as a monument historique by the Ministry of Culture.",https://en.wikipedia.org/wiki/H%C3%B4tel_de_Sully,Monument / Landmark,,
Hôtel de Sade,Hôtel de Sade,"The Hôtel de Sade is a building in Avignon, in the Vaucluse department.",https://fr.wikipedia.org/wiki/H%C3%B4tel_de_Sade,Historic Site,43.94774,4.80535
Chapelle des moines de Berz-la-Ville,Chapelle des moines de Berzé-la-Ville,The Chapel of the Moines is a Romanesque chapel integrated into a deanery called the Château des Moines located on the territory of the commune of Berzé-la-Ville in the French department of Saône-et-Loire in the Burgundy-Franche-Comté region.,https://fr.wikipedia.org/wiki/Chapelle_des_moines_de_Berz%C3%A9-la-Ville,Historic Site,46.363537,4.700467
Château de Bussy-Rabutin,Château de Bussy-Rabutin,"The Château de Bussy-Rabutin, also known as Château de Bussy-le-Grand, is a château which developed from a 12th-century castle, located in the commune of Bussy-le-Grand, in the Côte-d'Or department, Bourgogne, eastern France.",https://en.wikipedia.org/wiki/Ch%C3%A2teau_de_Bussy-Rabutin,Historic Site,,
Château de Bouges,Château de Bouges,"The Château de Bouges (French pronunciation: ) is an 18th-century mansion in the town of Bouges-le-Château, in the Indre département of France, in the Loire Valley. It is classified as a monument historique and the gardens are listed by the Ministry of Culture as among the Notable Gardens of France. The château and gardens are open to the public.",https://en.wikipedia.org/wiki/Ch%C3%A2teau_de_Bouges,Monument / Landmark,,
Colonne de Juillet,July Column,"The July Column (French: Colonne de Juillet, ) is a monumental column in Paris commemorating the Revolution of 1830. It stands in the center of the Place de la Bastille and celebrates the Trois Glorieuses — the 'three glorious' days of 27–29 July 1830 that saw the fall of Charles X, King of France, and the commencement of the July Monarchy of Louis-Philippe, King of the French. It was built between 1835 and 1840.",https://en.wikipedia.org/wiki/July_Column,Monument / Landmark,,
Conciergerie,Conciergerie,"The Conciergerie (French pronunciation: ) (English: Lodge) is a former courthouse and prison in Paris, France located on the west of the Île de la Cité below the Palais de Justice. It was originally part of the former royal palace, the Palais de la Cité, which also included the Sainte-Chapelle. Two large medieval halls remain from the royal palace. During the French Revolution, 2,781 prisoners, including Marie Antoinette, were imprisoned, tried and sentenced at the Conciergerie then sent to different sites to be executed by the guillotine. It’s now a national monument and museum.",https://en.wikipedia.org/wiki/Conciergerie,Monument / Landmark,,
Cathédrale Notre-Dame d'Amiens,Amiens Cathedral,"The Cathedral of Our Lady of Amiens (French: Cathédrale Notre-Dame d'Amiens), or simply Amiens Cathedral, is a Catholic cathedral. The cathedral is the seat of the Bishop of Amiens. It is situated on a slight ridge overlooking the River Somme in Amiens, the administrative capital of the Picardy region of France, some 120 kilometres (75 miles) north of Paris.",https://en.wikipedia.org/wiki/Amiens_Cathedral,Historic Site,,
Château d'Azay-le-Rideau,Château d'Azay-le-Rideau,"The Château d'Azay-le-Rideau (pronounced ) is located in the town of Azay-le-Rideau in the French département of Indre-et-Loire. Built between 1518 and 1527, this château is considered one of the foremost examples of early French renaissance architecture. Set on an island in the middle of the Indre river, this picturesque château has become one of the most popular of the châteaux of the Loire valley.",https://en.wikipedia.org/wiki/Ch%C3%A2teau_d%27Azay-le-Rideau,Historic Site,,
Château de Maisons,Château de Maisons,"The Château de Maisons (now Château de Maisons-Laffitte ), designed by François Mansart from 1630 to 1651, is a prime example of French Baroque architecture and a reference point in the history of French architecture. The château is located in Maisons-Laffitte, a northwestern suburb of Paris, in the department of Yvelines, Île-de-France.",https://en.wikipedia.org/wiki/Ch%C3%A2teau_de_Maisons,Historic Site,,
Abbaye de Montmajour,Montmajour Abbey,"Montmajour Abbey, formally the Abbey of St. Peter in Montmajour (French: Abbaye Saint-Pierre de Montmajour ; Occitan: Abadia de Sancte Pèire en Montmajour), was a fortified Benedictine monastery built between the 10th and 18th centuries on what was originally an island five kilometers north of Arles, in what is now the Bouches-du-Rhône Department, in the region of Provence in the south of France.",https://en.wikipedia.org/wiki/Montmajour_Abbey,Historic Site,,
Abbaye du Thoronet,Thoronet Abbey,"Thoronet Abbey (French: L'abbaye du Thoronet) is a former Cistercian abbey built in the late twelfth and early thirteenth century, now restored as a museum. It is sited between the towns of Draguignan and Brignoles in the Var Department of Provence, in southeast France. It is one of the three Cistercian abbeys in Provence, along with the Sénanque Abbey and Silvacane, that together are known as ""the Three Sisters of Provence.""",https://en.wikipedia.org/wiki/Thoronet_Abbey,Museum,,
Panthéon,Panthéon,"The Panthéon (French:  ⓘ, from Ancient Greek πάνθειον (pántheion) ' to all the gods') is a monument in the 5th arrondissement of Paris, France. It stands in the Latin Quarter (Quartier Latin), on the Montagne Sainte-Geneviève, in the centre of the Place du Panthéon, which was named after it. The edifice was built between 1758 and 1790, from designs by Jacques-Germain Soufflot, at the behest of King Louis XV; the king intended it as a church dedicated to Saint Genevieve, Paris's patron saint, whose relics were to be housed in the church. Neither Soufflot nor Louis XV lived to see the church completed.",https://en.wikipedia.org/wiki/Panth%C3%A9on,Monument / Landmark,,
Château de Châteaudun,Château de Châteaudun,The Château de Châteaudun is a castle located in the town of Châteaudun in the French department of Eure-et-Loir.,https://en.wikipedia.org/wiki/Ch%C3%A2teau_de_Ch%C3%A2teaudun,Historic Site,,
Villa Savoye,Villa Savoye,"Villa Savoye (French pronunciation: ) is a modernist villa and gatelodge in Poissy, on the outskirts of Paris, France. It was designed by the Swiss-French architect Le Corbusier and his cousin Pierre Jeanneret, and built between 1928 and 1931 using reinforced concrete.",https://en.wikipedia.org/wiki/Villa_Savoye,Historic Site,,
Château de Fougères-sur-Bièvre,Château de Fougères-sur-Bièvre,"The Château de Fougères-sur-Bièvre is a castle in the commune of Fougères-sur-Bièvre, in the French department of Loir-et-Cher.",https://en.wikipedia.org/wiki/Ch%C3%A2teau_de_Foug%C3%A8res-sur-Bi%C3%A8vre,Historic Site,,
Château de Puyguilhem,Château de Puyguilhem,Puyguilhem Castle may refer to two French castles in the Dordogne:,https://fr.wikipedia.org/wiki/Ch%C3%A2teau_de_Puyguilhem,Historic Site,,
Château d'If,Château d'If,"The Château d'If (French pronunciation: ; Occitan: Castèl d'If) is a fortress located on the Île d'If (Ilha d'If), the smallest island in the Frioul archipelago, situated about 1.5 kilometres (7⁄8 mile) offshore from Marseille in southeastern France. Built in the 16th century, it later served as a prison until the end of the 19th century. The fortress was demilitarized and opened to the public in 1890. It is famous for being one of the settings of Alexandre Dumas's adventure novel The Count of Monte Cristo. It is one of the most visited sites in the city of Marseille (nearly 100,000 visitors per year).",https://en.wikipedia.org/wiki/Ch%C3%A2teau_d%27If,Historic Site,,
Tours de La Rochelle,La Rochelle,"La Rochelle Listenⓘ is a French commune, prefecture of the Charente-Maritime department, in the Nouvelle-Aquitaine region.",https://fr.wikipedia.org/wiki/La_Rochelle,Historic Site,46.159058,-1.151715
Château de Montal,Château de Montal,"The Château de Montal is a French Renaissance château located in the heart of the valley of the Bave in the commune of Saint-Jean-Lespinasse in Lot department in the region of Occitanie, in southwestern France. The château has been classified as a historical monuments since 14 June 1909.",https://en.wikipedia.org/wiki/Ch%C3%A2teau_de_Montal,Monument / Landmark,,
Château de Pierrefonds,Château de Pierrefonds,"The Château de Pierrefonds (French pronunciation: ) is a castle situated in the commune of Pierrefonds in the Oise department in the Hauts-de-France region, Northern France.",https://en.wikipedia.org/wiki/Ch%C3%A2teau_de_Pierrefonds,Historic Site,,
Villa Cavrois,Villa Cavrois,"Villa Cavrois in Croix is a large modernist mansion built in 1932 by French architect Robert Mallet-Stevens for Paul Cavrois, an industrialist from Roubaix active in the textile industry.",https://en.wikipedia.org/wiki/Villa_Cavrois,Historic Site,,
Cité internationale de la langue française - château de Villers-Cotterêts,Cité internationale de la langue française,"The Cité internationale de la langue française (sometimes abbreviated CILF) is a cultural place entirely dedicated to the French language and French-speaking cultures. It took place at the Château de Villers-Cotterêts, in the Aisne department, in the Hauts-de-France region. This castle is the very place where King François I signed the ordinance of 1539 making the use of French obligatory in administrative and judicial acts in France.",https://fr.wikipedia.org/wiki/Cit%C3%A9_internationale_de_la_langue_fran%C3%A7aise,Historic Site,49.255090033691,3.0917870813378
Maison et jardins de Georges Clemenceau,Maison de Georges Clemenceau,"The house and gardens of Georges Clemenceau is a country house-beach house in Vendée, on the edge of the Atlantic Ocean, at a place called “Bélesbat” (renamed Belébat) in Saint-Vincent-sur-Jard in Vendée (Pays de la Loire). Famous for having belonged to the politician Georges Clemenceau during the last ten years of his life, from 1919 to 1929, this house museum and its gardens have been classified as historic monuments since July 10, 1970, and labeled Maisons des Illustres since 2011.",https://fr.wikipedia.org/wiki/Maison_de_Georges_Clemenceau,Monument / Landmark,46.4063,-1.5475
Château de Castelnau-Bretenoux,Château de Castelnau-Bretenoux,"The Château de Castelnau-Bretenoux (French pronunciation: ) is a castle in the commune of Prudhomat, Lot département, France. One of the most impressive in the Quercy region, it has been listed as a monument historique by the French Ministry of Culture since 1862.",https://en.wikipedia.org/wiki/Ch%C3%A2teau_de_Castelnau-Bretenoux,Monument / Landmark,,
Monastère de Saorge,Monastère de Saorge,"The Saorge Monastery is a former Catholic monastery located in Saorge, France.",https://fr.wikipedia.org/wiki/Monast%C3%A8re_de_Saorge,Historic Site,43.9849,7.55509
Chapelle expiatoire,Chapelle expiatoire,"The Chapelle expiatoire (French pronunciation: , ""Expiatory Chapel"") is a Roman Catholic chapel located in the 8th arrondissement of Paris, France. The chapel was constructed by Louis XVIII on the grounds where King Louis XVI and Queen Marie Antoinette had been buried after they had been guillotined, and it is dedicated to them as an expiation for that act. The remains of Louis XVI and Marie Antoinette are not in the chapel; they are in the Basilica of Saint-Denis, near Paris, with other French monarchs.",https://en.wikipedia.org/wiki/Chapelle_expiatoire,Historic Site,,
Palais Jacques Cœur,Palais Jacques Coeur,"The Palais Jacques Cœur is a large hôtel particulier built by Jacques Cœur for himself and his family in Bourges, France. Built and decorated in the flamboyant style, it is widely viewed as one of the most prominent examples of French civilian architecture in the 15th century.",https://en.wikipedia.org/wiki/Palais_Jacques_Coeur,Historic Site,,
Cloître de la Psalette,Cloître de la Psalette,"The cloister of the Saint-Gatien cathedral of Tours, or Psalette cloister, is located in the Saint-Gatien district of Vieux-Tours. It is managed by the Center des monuments nationaux. It has been classified as a historic monument since 1889.",https://fr.wikipedia.org/wiki/Clo%C3%AEtre_de_la_Psalette,Monument / Landmark,47.3961,0.69508
Château de Champs-sur-Marne,Château de Champs-sur-Marne,"The Château de Champs-sur-Marne (French pronunciation: ) is a neoclassical château in Champs-sur-Marne, France. It was built in its present form for the treasurer Charles Renouard de la Touane in 1699 by Pierre Bullet, architecte du roi. After the first proprietor's bankruptcy, another financier, Paul Poisson de Bourvalais, took up the project. Jean-Baptiste Bullet de Chamblain, the son of Pierre Bullet, finished Champs in 1706.",https://en.wikipedia.org/wiki/Ch%C3%A2teau_de_Champs-sur-Marne,Historic Site,,
Château de Villeneuve-Lembron,Château de Villeneuve-Lembron,"Villeneuve-Lembron Castle is a castle located in Villeneuve between Clermont-Ferrand and Saint-Flour, in the Puy-de-Dôme department in France. Managed on behalf of the State by the Center for National Monuments, it is renowned for the interest of its painted decorations.",https://fr.wikipedia.org/wiki/Ch%C3%A2teau_de_Villeneuve-Lembron,Monument / Landmark,45.477983,3.18597
Château d'Oiron,Château d'Oiron,"The Château d'Oiron is located in Oiron, in the Deux-Sèvres département of western France. It has its origins in the 15th century war with the English for control of France when a victorious Charles VII of France gave the domain and great forest of Oiron to Guillaume Gouffier who became governor of Touraine. This château is the background for Charles Perrault's fairy tale, Puss in Boots. King Louis XIV's mistress, Madame de Montespan was one of the residents in the place.",https://en.wikipedia.org/wiki/Ch%C3%A2teau_d%27Oiron,Historic Site,,
Site des mégalithes de Locmariaquer,Site des mégalithes de Locmariaquer,"The Locmariaquer megalith site is a megalithic complex located in Locmariaquer and managed by the Center des monuments nationaux. The site presents three megaliths illustrating the diversity of Neolithic constructions in Morbihan built between -5000 and -3800 years ago: the large broken menhir of Er Grah, the tumulus of Er Grah, the Marchand table.",https://fr.wikipedia.org/wiki/Site_des_m%C3%A9galithes_de_Locmariaquer,Monument / Landmark,47.572306,-2.950694
Abbaye de Cluny,Cluny Abbey,"Cluny Abbey (French: ; French: Abbaye de Cluny, formerly also Cluni or Clugny; Latin: Abbatia Cluniacensis) is a former Benedictine monastery in Cluny, Saône-et-Loire, France. It was dedicated to Saints Peter and Paul.",https://en.wikipedia.org/wiki/Cluny_Abbey,Historic Site,,
Ensemble cathédrale du Puy-en-Velay,Cathédrale Notre-Dame du Puy-en-Velay,"Notre-Dame Cathedral in Puy-en-Velay is a major monument of Romanesque art and Western Christianity. It was erected as a minor basilica by an apostolic brief from Pius IX on February 11, 1856. Its full title is Notre-Dame-de-l'Annonciation du Puy-en-Velay.",https://fr.wikipedia.org/wiki/Cath%C3%A9drale_Notre-Dame_du_Puy-en-Velay,Monument / Landmark,45.045556,3.884722
Sites préhistoriques de la vallée de la Vézère,Sites préhistoriques et grottes ornées de la vallée de la Vézère,"The prehistoric sites and decorated caves of the Vézère valley constitute a set of exceptional prehistoric sites, spread over around forty kilometers along the Vézère valley between Les Eyzies-de-Tayac and Montignac, in Dordogne, Nouvelle-Aquitaine region, in France.",https://fr.wikipedia.org/wiki/Sites_pr%C3%A9historiques_et_grottes_orn%C3%A9es_de_la_vall%C3%A9e_de_la_V%C3%A9z%C3%A8re,Historic Site,,
Maison de George Sand,Domaine de George Sand,"The George Sand estate - often referred to simply as George Sand's house or Nohant castle - is an 18th century castle, located in Nohant-Vic, about thirty kilometers from Châteauroux.",https://fr.wikipedia.org/wiki/Domaine_de_George_Sand,Historic Site,46.62502,1.975297
Sainte-Chapelle,Sainte-Chapelle,"The Sainte-Chapelle (French: ; English: Holy Chapel) is a royal chapel in the Gothic style, within the medieval Palais de la Cité, the residence of the Kings of France until the 14th century, on the Île de la Cité in the River Seine in Paris, France.",https://en.wikipedia.org/wiki/Sainte-Chapelle,Historic Site,,
Tours de la cathédrale de Reims,Cathédrale Notre-Dame de Reims,"Notre-Dame de Reims Cathedral is a Roman Catholic cathedral located in Reims, in the French department of Marne in the Grand Est region. It is known to have been, from the 11th century, the place of almost all the coronations of the kings of France.",https://fr.wikipedia.org/wiki/Cath%C3%A9drale_Notre-Dame_de_Reims,Historic Site,49.253611,4.033889
Château ducal de Cadillac,Château de Cadillac,"Cadillac Castle is located in the commune of Cadillac, in the French department of Gironde. The castle, the moat and the garden are classified as historic monuments by the 1862 list and by decree of July 12, 1956; the door to the vegetable garden was listed as a historic monument in 1965.",https://fr.wikipedia.org/wiki/Ch%C3%A2teau_de_Cadillac,Monument / Landmark,44.638,-0.3204
Cloître de la cathédrale de Bayonne,Cathédrale Sainte-Marie de Bayonne,"Sainte-Marie Cathedral or Notre-Dame de Bayonne is a Latin rite Catholic cathedral located in the Pyrénées-Atlantiques department (southwest of France). Built in the 13th and 14th centuries, it is characteristic of the Gothic style. It is the episcopal seat of the diocese of Bayonne.",https://fr.wikipedia.org/wiki/Cath%C3%A9drale_Sainte-Marie_de_Bayonne,Historic Site,43.490556,-1.4775
Château de La Motte Tilly,Château de La Motte-Tilly,"Château de La Motte-Tilly is a castle in the commune of La Motte-Tilly, 7 kilometres (4 mi) south-west of Nogent-sur-Seine, Aube, France. It is on the left bank of the Seine and has been open to the public since 1978. The château is managed by the Centre des monuments nationaux.",https://en.wikipedia.org/wiki/Ch%C3%A2teau_de_La_Motte-Tilly,Monument / Landmark,,
Abbaye du Bec-Hellouin,Abbaye Notre-Dame du Bec,"Notre-Dame du Bec Abbey is a Benedictine Catholic abbey, today part of the congregation of Sainte-Marie du Mont-Olivet and located in Bec-Hellouin, near Brionne, in the Eure department, in Normandy. It was founded in 1034 by Herluin, or Helloin, hence its name, knight of Count Gilbert de Brionne.",https://fr.wikipedia.org/wiki/Abbaye_Notre-Dame_du_Bec,Historic Site,49.2325,0.721666666667
